{
  "category": "8",
  "subcategory": "B",
  "name": "Schwarzbier",
  "overallImpression": "Een sterk koolzuurhoudend, zeer licht bier met bijna geen smaak, ontworpen om zeer koud geconsumeerd te worden. Zeer verfrissend en dorstlessend.",
  "aroma": "Laag moutaroma optioneel, maar kan worden waargenomen als graanachtig, zoet, of maïsachtig, indien aanwezig. Licht kruidig, bloemig, of kruiden hoparoma optioneel. Hoewel een schoon fermentatieprofiel wenselijk is, is een lichte hoeveelheid gistkarakter geen fout.",
  "appearance": "Zeer lichtgele tot lichtgele kleur. Witte, schuimige kroon houdt zelden stand. Zeer helder.",
  "flavor": "Relatief neutraal mondgevoel met een frisse, droge afdronk en een lage tot zeer lage graanachtige of maïsachtige smaak die als zoetheid kan worden ervaren vanwege de lage bitterheid. Lage bloemige, kruidig-pittige of kruidige hopsmaak optioneel, maar zelden sterk genoeg om te detecteren. Lage tot zeer lage bitterheid. Balans kan variëren van licht moutig tot licht bitter, maar is meestal bijna gelijk. Hoge koolzuur kan de frisheid van de droge afdronk accentueren. Schoon gistingsprofiel.",
  "mouthfeel": "Zeer licht, soms waterig mondgevoel. Zeer hoog gekoolzuurd met lichte koolzuurbeet op de tong.",
  "comments": "Ontworpen om een zo breed mogelijk publiek aan te spreken. Sterke smaken zijn een fout. Met weinig mout- of hopsmaak is het gistkarakter vaak wat merken het meest van elkaar onderscheidt.",
  "history": "Coors brouwde kort een licht lager in de vroege jaren 1940. Moderne versies werden eerst geproduceerd door Rheingold in 1967 om dieetbewuste drinkers aan te spreken, maar werden pas populair vanaf 1973 nadat Miller Brewing het recept verwierf en het bier intensief vermarktte aan sportfans met de \"tastes great, less filling\" campagne. Bieren van dit genre werden de grootste verkopers in de Verenigde Staten in de jaren 1990.",
  "characteristicIngredients": "Twee- of zesrijige gerst met tot 40% rijst of maïs als bijstoffen. Aanvullende enzymen kunnen het lichaam verder verlichten en koolhydraten verlagen. Lagergist. Verwaarloosbare hop.",
  "styleComparison": "Een lichter lichaam, lager alcoholpercentage, minder calorieën versie van een American Lager. Minder hopkarakter en bitterheid dan een German Leichtbier.",
  "entryInstructions": "Inzender mag regionale variaties specificeren, indien gewenst (Mexicaans lager, Nederlands lager, enz.).",
  "vitalStatistics": {
    "og": {
      "min": 1.028,
      "max": 1.04
    },
    "fg": {
      "min": 0.998,
      "max": 1.008
    },
    "ibu": {
      "min": 8,
      "max": 12
    },
    "srm": {
      "min": 2.0,
      "max": 3.0
    },
    "abv": {
      "min": 2.8,
      "max": 4.2
    }
  },
  "commercialExamples": [
    "Bud Light",
    "Coors Light",
    "Grain Belt Premium Light American Lager",
    "Michelob Light",
    "Miller Lite",
    "Old Milwaukee Light"
  ],
  "tags": [
    "session-strength",
    "pale-color",
    "bottom-fermented",
    "lagered",
    "north-america",
    "traditional-style",
    "pale-lager-family",
    "balanced"
  ]
}