{
  "category": "1",
  "subcategory": "A",
  "name": "American Light Lager",
  "overallImpression": "Een zeer koolzuurrijke, zeer lichte lager met bijna geen smaak, ontworpen om zeer koud geconsumeerd te worden. Zeer verfrissend en dorstlessend.",
  "aroma": "Laag moutaroma optioneel, maar kan waargenomen worden als graanachtig, zoet, of maïsachtig, indien aanwezig. Licht kruidig, bloemig, of kruidachtig hoparoma optioneel. Hoewel een schoon fermentatieprofiel wenselijk is, is een lichte hoeveelheid gistkarakter geen fout.",
  "appearance": "Zeer bleek strogeel tot lichtgele kleur. Wit, schuimig hoofd houdt zelden stand. Zeer helder.",
  "flavor": "Relatief neutraal gehemelte met een frisse, droge afdronk en een lage tot zeer lage graanachtige of maïsachtige smaak die mogelijk als zoetheid ervaren wordt vanwege de lage bitterheid. Lage bloemige, kruidige, of kruidachtige hopsmaak optioneel, maar is zelden sterk genoeg om te detecteren. Lage tot zeer lage bitterheid. Balans kan variëren van licht moutig tot licht bitter, maar is meestal dicht bij gelijk. Hoog koolzuur kan de frisheid van de droge afdronk accentueren. Schoon fermentatieprofiel.",
  "mouthfeel": "Zeer lichte, soms waterige body. Zeer hoog gekoolzuurd met lichte koolzuurbeet op de tong.",
  "comments": "Ontworpen om zo breed mogelijk te appelleren aan het algemene publiek. Sterke smaken zijn een fout. Met weinig mout- of hopsmaak is het gistkarakter vaak wat merken het meest onderscheidt.",
  "history": "Coors maakte kort een light lager in de vroege jaren 1940. Moderne versies werden eerst geproduceerd door Rheingold in 1967 om dieetbewuste drinkers aan te spreken, maar werden pas populair vanaf 1973 nadat Miller Brewing het recept overnam en het bier zwaar op de markt bracht bij sportfans met de 'tastes great, less filling' campagne. Bieren van dit genre werden de grootste verkopers in de Verenigde Staten in de jaren 1990.",
  "characteristicIngredients": "Twee- of zesrijige gerst met tot 40% rijst of maïs als hulpstoffen. Aanvullende enzymen kunnen de body verder verlichten en koolhydraten verlagen. Lagergist. Verwaarloosbare hop.",
  "styleComparison": "Een lichter, lager-alcohol, lager-calorie versie van een American Lager. Minder hopkarakter en bitterheid dan een Duitse Leichtbier.",
  "entryInstructions": "Inzender mag regionale variaties specificeren, indien gewenst (Mexicaanse lager, Nederlandse lager, etc.).",
  "vitalStatistics": {
    "og": {
      "min": 1.028,
      "max": 1.04
    },
    "fg": {
      "min": 0.998,
      "max": 1.008
    },
    "ibu": {
      "min": 8,
      "max": 12
    },
    "srm": {
      "min": 2.0,
      "max": 3.0
    },
    "abv": {
      "min": 2.8,
      "max": 4.2
    }
  },
  "commercialExamples": [
    "Bud Light",
    "Coors Light",
    "Grain Belt Premium Light American Lager",
    "Michelob Light",
    "Miller Lite",
    "Old Milwaukee Light"
  ],
  "tags": [
    "session-strength",
    "pale-color",
    "bottom-fermented",
    "lagered",
    "north-america",
    "traditional-style",
    "pale-lager-family",
    "balanced"
  ]
}