{
  "category": "1",
  "subcategory": "B",
  "name": "Amerikaanse Lager",
  "overallImpression": "Een sterk koolzuurhoudend, zeer licht bier met nauwelijks smaak, ontworpen om zeer koud gedronken te worden. Zeer verfrissend en dorstlessend.",
  "aroma": "Laag moutaroma optioneel, maar kan worden waargenomen als graanachtig, zoet of maïsachtig, indien aanwezig. Licht kruidig, bloemig of kruidachtig hoparoma optioneel. Hoewel een schoon gistingsprofiel wenselijk is, is een lichte hoeveelheid gistkarakter geen fout.",
  "appearance": "Zeer licht stroogeel tot lichtgele kleur. Wit, schuimig hoofd houdt zelden lang stand. Zeer helder.",
  "flavor": "Relatief neutraal verhemelte met een knapperige, droge afdronk en een lage tot zeer lage graanachtige of maïsachtige smaak die als zoetheid kan worden waargenomen vanwege de lage bitterheid. Lage bloemige, kruidige of kruidachtige hopsmaak optioneel, maar zelden sterk genoeg om te detecteren. Lage tot zeer lage bitterheid. Balans kan variëren van licht moutig tot licht bitter, maar is meestal bijna gelijk. Hoog koolzuurgehalte kan de knapperigheid van de droge afdronk accentueren. Schoon gistingsprofiel.",
  "mouthfeel": "Zeer licht, soms waterig mondgevoel. Zeer sterk koolzuurhoudend met lichte koolzuurbeet op de tong.",
  "comments": "Ontworpen om zo breed mogelijk te appelleren aan het algemene publiek. Sterke smaken zijn een fout. Met weinig mout- of hopsmaak is het gistkarakter vaak wat merken het meest van elkaar onderscheidt.",
  "history": "Coors maakte kort een light lager in de vroege jaren 1940. Moderne versies werden voor het eerst geproduceerd door Rheingold in 1967 om dieetbewuste drinkers aan te spreken, maar werden pas populair vanaf 1973 nadat Miller Brewing het recept verwierf en het bier zwaar op de markt bracht naar sportfans met de 'tastes great, less filling' campagne. Bieren van dit genre werden de grootste verkopers in de Verenigde Staten in de jaren 1990.",
  "characteristicIngredients": "Twee- of zesrijige gerst met tot 40% rijst of maïs als hulpstoffen. Extra enzymen kunnen het lichaam verder verlichten en koolhydraten verlagen. Lagergist. Verwaarloosbare hop.",
  "styleComparison": "Een lichter, lager alcohol, lager calorieën versie van een Amerikaanse Lager. Minder hopkarakter en bitterheid dan een Duitse Leichtbier.",
  "entryInstructions": "Deelnemer mag regionale variaties specificeren, indien gewenst (Mexicaanse lager, Nederlandse lager, enz.).",
  "vitalStatistics": {
    "og": {
      "min": 1.028,
      "max": 1.04
    },
    "fg": {
      "min": 0.998,
      "max": 1.008
    },
    "ibu": {
      "min": 8,
      "max": 12
    },
    "srm": {
      "min": 2.0,
      "max": 3.0
    },
    "abv": {
      "min": 2.8,
      "max": 4.2
    }
  },
  "commercialExamples": [
    "Bud Light",
    "Coors Light",
    "Grain Belt Premium Light American Lager",
    "Michelob Light",
    "Miller Lite",
    "Old Milwaukee Light"
  ],
  "tags": [
    "session-strength",
    "pale-color",
    "bottom-fermented",
    "lagered",
    "north-america",
    "traditional-style",
    "pale-lager-family",
    "balanced"
  ]
}