{
  "category": "5",
  "subcategory": "A",
  "name": "German Leichtbier",
  "overallImpression": "Een licht, sterk vergist, lichaamsloos Duits lager met lager alcohol en calorieën dan bieren van standaardsterkte. Matig bitter met merkbare mout- en hopsmaken, het bier is nog steeds interessant om te drinken.",
  "aroma": "Laag tot matig hoparoma, met een kruidig, kruiden- of bloemig karakter. Laag tot matig-laag graanachtig-zoet of licht knapperig moutaroma. Schoon gistingsprofiel.",
  "appearance": "Licht strogeel tot diep geel van kleur. Briljante helderheid. Matig wit schuim met gemiddelde tot beneden gemiddelde persistentie.",
  "flavor": "Aanvankelijk lage tot matige graanachtig-zoete moutsmaak. Matige hopbitterheid. Lage tot matige hopsmaak, met een kruidig, kruiden- of bloemig karakter. Schoon gistingskarakter, goed gelagerd. Droge afdronk met een lichte moutige en hoppige nasmaak.",
  "mouthfeel": "Licht tot zeer licht lichaam. Matig tot hoog koolzuur. Glad, goed vergist.",
  "comments": "Voornamelijk op de markt gebracht als een diëet-georiënteerd bier met lagere koolhydraten, alcohol en calorieën. Uitgesproken als 'LYESHT-beer.' Kan ook bekend zijn als een Diat Pils of Helles, deze stijl valt in de schankbier zwaarteklasse. Andere variaties van Leicht klasse bieren kunnen gemaakt worden van Weissbier, Kölsch en Altbier; die bieren worden het best ingediend als 34B Mixed-Style Beer.",
  "history": "Traditionele versies bestonden als dranken voor fysieke arbeiders in fabrieken of velden, maar moderne versies zijn meer gebaseerd op populaire Amerikaanse producten in dezelfde klasse en gericht op gezondheids- of fitnessbewuste consumenten. Wordt in de huidige markt steeds meer verdrongen door alcoholvrije bieren en radlers.",
  "characteristicIngredients": "Continentale Pils mout. Duitse lagergist. Traditionele Duitse hop.",
  "styleComparison": "Als een lager-alcohol, lichter lichaam, iets minder agressief Duits Pils of Munich Helles. Bitterder en smaakvoller dan een American Light Lager.",
  "vitalStatistics": {
    "og": {
      "min": 1.026,
      "max": 1.034
    },
    "fg": {
      "min": 1.006,
      "max": 1.01
    },
    "ibu": {
      "min": 15,
      "max": 28
    },
    "srm": {
      "min": 1.5,
      "max": 4.0
    },
    "abv": {
      "min": 2.4,
      "max": 3.6
    }
  },
  "commercialExamples": [
    "Autenrieder Schlossbräu Leicht",
    "Greif Bräu Leicht",
    "Hohenthanner Tannen Hell Leicht",
    "Müllerbrau Heimer Leicht",
    "Schönramer Surtaler Schankbier",
    "Waldhaus Sommer Bier"
  ],
  "tags": [
    "session-strength",
    "pale-color",
    "bottom-fermented",
    "lagered",
    "central-europe",
    "traditional-style",
    "pale-lager-family",
    "bitter",
    "hoppy"
  ]
}