{
  "category": "1",
  "subcategory": "6",
  "name": "Foreign Extra Stout",
  "overallImpression": "Een sterk koolzuurhoudend, zeer licht van body, bijna smaakloos lager ontworpen om zeer koud geconsumeerd te worden. Zeer verfrissend en dorstlessend.",
  "aroma": "Laag moutaroma optioneel, maar kan worden waargenomen als graanachtig, zoet, of maïsachtig, indien aanwezig. Licht kruidig, bloemig, of kruidig hoparoma optioneel. Hoewel een schoon gistingsprofiel wenselijk is, is een lichte hoeveelheid gistkarakter geen fout.",
  "appearance": "Zeer licht strookleurig tot lichtgeel van kleur. Wit, schuimig schuim houdt zelden lang stand. Zeer helder.",
  "flavor": "Relatief neutraal gehemelte met een frisse, droge afdronk en een lage tot zeer lage graanachtige of maïsachtige smaak die als zoetheid kan worden waargenomen vanwege de lage bitterheid. Lage bloemige, kruidige, of kruidige hopsmaak optioneel, maar is zelden sterk genoeg om te detecteren. Lage tot zeer lage bitterheid. Balans kan variëren van licht moutig tot licht bitter, maar is meestal dicht bij evenwichtig. Hoog koolzuur kan de frisheid van de droge afdronk accentueren. Schoon gistingsprofiel.",
  "mouthfeel": "Zeer lichte, soms waterige body. Zeer sterk koolzuurhoudend met lichte koolzuurbeet op de tong.",
  "comments": "Ontworpen om zo breed mogelijk aan het algemene publiek te appeleren. Sterke smaken zijn een fout. Met weinig mout- of hopsmaak is het gistkarakter vaak wat de meeste merken van elkaar onderscheidt.",
  "history": "Coors maakte kort een light lager in de vroege jaren 1940. Moderne versies werden voor het eerst geproduceerd door Rheingold in 1967 om dieetbewuste drinkers aan te spreken, maar werden pas populair vanaf 1973 nadat Miller Brewing het recept verwierf en het bier zwaar op de markt bracht naar sportfans met de 'tastes great, less filling' campagne. Bieren van dit genre werden de grootste verkopers in de Verenigde Staten in de jaren 1990.",
  "characteristicIngredients": "Twee- of zesrijige gerst met tot 40% rijst of maïs als hulpstoffen. Aanvullende enzymen kunnen de body verder verlichten en koolhydraten verlagen. Lagergist. Verwaarloosbare hop.",
  "styleComparison": "Een lichter van body, lager alcohol, lagere calorie versie van een American Lager. Minder hopkarakter en bitterheid dan een German Leichtbier.",
  "entryInstructions": "Deelnemer mag regionale variaties specificeren, indien gewenst (Mexicaanse lager, Nederlandse lager, etc.).",
  "vitalStatistics": {
    "og": {
      "min": 1.028,
      "max": 1.04
    },
    "fg": {
      "min": 0.998,
      "max": 1.008
    },
    "ibu": {
      "min": 8,
      "max": 12
    },
    "srm": {
      "min": 2.0,
      "max": 3.0
    },
    "abv": {
      "min": 2.8,
      "max": 4.2
    }
  },
  "commercialExamples": [
    "Bud Light",
    "Coors Light",
    "Grain Belt Premium Light American Lager",
    "Michelob Light",
    "Miller Lite",
    "Old Milwaukee Light"
  ],
  "tags": [
    "session-strength",
    "pale-color",
    "bottom-fermented",
    "lagered",
    "north-america",
    "traditional-style",
    "pale-lager-family",
    "balanced"
  ]
}