{
  "category": "17",
  "subcategory": "A",
  "name": "British Strong Ale",
  "overallImpression": "Een ale met respectabele alcoholsterkte, traditioneel fles-geconditioneerd en gekeldered. Kan een breed scala aan interpretaties hebben, maar de meeste zullen variërende graden van moutige rijkdom, late hop en bitterheid, fruitige esters en alcoholwarmte hebben. De mout- en hulpstofsmaken en intensiteit kunnen sterk variëren, maar elke combinatie zou moeten resulteren in een aangename smaakervaring.",
  "aroma": "Moutig-zoet met fruitige esters, vaak met een complexe mengeling van gedroogd fruit, karamel, noten, toffee of andere speciale moutaroma's. Enkele alcoholnoten zijn acceptabel, maar zouden niet heet of oplosmiddelachtig moeten zijn. Hoparoma's kunnen sterk variëren, maar hebben typisch aardse, harsachtige, fruitige of bloemige noten. De balans kan sterk variëren, maar de meeste voorbeelden zullen een mengeling van mout, fruit, hop en alcohol hebben in variërende intensiteiten.",
  "appearance": "Amber tot donker roodbruin van kleur; vele zijn vrij donker. Over het algemeen helder, hoewel donkere versies bijna ondoorzichtig kunnen zijn. Matige tot lage crème- tot lichtbruine schuimkraag met gemiddelde retentie.",
  "flavor": "Matig tot hoog moutkarakter, vaak rijk met nootachtige, toffee of karamelsmaak. Lichte chocoladenoten worden soms gevonden in donkere bieren. Kan interessante smaakcomplexiteit hebben van brouwsuikers. Balans is vaak moutig, maar kan goed gehopt zijn, wat de indruk van moutigheid beïnvloedt. Matige fruitige esters zijn gebruikelijk, vaak met een donker fruit of gedroogd fruit karakter. De afdronk kan variëren van matig droog tot enigszins zoet. Alcoholsterkte zou evident moeten zijn, niet overweldigend. Laag diacetyl optioneel, maar over het algemeen niet wenselijk.",
  "mouthfeel": "Matig tot vol, kauwbaar lichaam. Alcoholwarmte is vaak evident en altijd welkom. Laag tot matig koolzuur. Gladde textuur.",
  "comments": "Meer een toegangscategorie dan een stijl; de sterkte en het karakter van voorbeelden kunnen sterk variëren. Past in de stijlruimte tussen normale zwaartekracht bieren en Barley Wines. Kan lichte moutig-hoppige bieren, Engelse winterverwarmers, sterke donkere milds, kleinere Burton ales en andere unieke bieren in het algemene zwaartekrachtbereik die niet in andere categorieën passen, omvatten. Juryleden zouden een significante variatie in karakter moeten toestaan, zolang het bier binnen het alcoholsterktegebied valt en een interessant 'Brits' karakter heeft, past het waarschijnlijk bij de stijl.",
  "history": "Een verzameling van ongerelateerde kleine stijlen, elk met zijn eigen erfgoed. Gebruik deze categoriegroepering niet om een historische relatie tussen voorbeelden af te leiden – geen is bedoeld. Dit is een moderne Britse specialiteit juryrategorie waar het 'speciale' attribuut het alcoholniveau is.",
  "characteristicIngredients": "Gristen variëren, vaak gebaseerd op lichte mout met karamel en specialiteitsmouten. Enkele donkere voorbeelden suggereren een licht gebruik van donkere mouten (bijv. chocolade, zwarte mout). Suikerachtige en zetmeelachtige hulpstoffen (bijv. maïs, gevlakte gerst, tarwe) zijn gebruikelijk. Afwerkingshop zijn traditioneel Engels.",
  "styleComparison": "Significante overlap in zwaartekracht met Old Ale, maar zonder een gerijpt karakter. Een breed scala aan interpretaties is mogelijk. Zou niet zo rijk of sterk moeten zijn als een English Barley Wine. Sterker dan de sterkere dagelijkse Strong Bitter, British Brown Ale en English Porter. Meer specialiteitsmout of suikerkarakter dan American Strong Ale.",
  "vitalStatistics": {
    "og": {
      "min": 1.055,
      "max": 1.08
    },
    "fg": {
      "min": 1.015,
      "max": 1.022
    },
    "ibu": {
      "min": 30,
      "max": 60
    },
    "srm": {
      "min": 8.0,
      "max": 22.0
    },
    "abv": {
      "min": 5.5,
      "max": 8.0
    }
  },
  "commercialExamples": [
    "Fuller's 1845",
    "Harvey's Elizabethan Ale",
    "J.W. Lees Moonraker",
    "McEwan's Champion",
    "Samuel Smith's Winter Welcome",
    "Shepherd Neame 1698"
  ],
  "tags": [
    "high-strength",
    "amber-color",
    "top-fermented",
    "british-isles",
    "traditional-style",
    "strong-ale-family",
    "malty"
  ]
}