{
  "category": "1",
  "subcategory": "2",
  "name": "Australische Sparkling Ale",
  "overallImpression": "Een sterk koolzuurhoudend, zeer licht bier met bijna geen smaak, ontworpen om heel koud gedronken te worden. Zeer verfrissend en dorstlessend.",
  "aroma": "Lage moutaroma optioneel, maar kan worden waargenomen als graanachtig, zoet of maisachtig, indien aanwezig. Lichte kruidig, bloemige of kruidige hoparoma optioneel. Hoewel een schoon gistingsprofiel wenselijk is, is een lichte hoeveelheid gistkarakter geen fout.",
  "appearance": "Zeer lichtgele tot bleekgele kleur. Witte, schuimige kraag blijft zelden lang bestaan. Zeer helder.",
  "flavor": "Relatief neutraal smaakprofiel met een krokante, droge afdronk en een lage tot zeer lage graanachtige of maisachtige smaak die als zoetheid kan worden ervaren vanwege de lage bitterheid. Lage bloemige, kruidig of kruidige hopsmaak optioneel, maar is zelden sterk genoeg om te detecteren. Lage tot zeer lage bitterheid. Balans kan variëren van licht moutig tot licht bitter, maar is meestal bijna gelijk. Hoog koolzuurgehalte kan de krokanttheid van de droge afdronk accentueren. Schoon gistingsprofiel.",
  "mouthfeel": "Zeer licht, soms waterig mondgevoel. Zeer sterk koolzuurhoudend met lichte koolzuurbeet op de tong.",
  "comments": "Ontworpen om te appelleren aan zo breed mogelijk publiek. Sterke smaken zijn een fout. Met weinig mout- of hopsmaak is het gistkarakter vaak wat de meeste merken onderscheidt.",
  "history": "Coors maakte kort een licht lager in de vroege jaren 1940. Moderne versies werden voor het eerst geproduceerd door Rheingold in 1967 om dieetbewuste drinkers aan te spreken, maar werden pas populair vanaf 1973 nadat Miller Brewing het recept verwierf en het bier intensief op de markt bracht bij sportfans met de 'tastes great, less filling' campagne. Bieren van dit genre werden de grootste verkopers in de Verenigde Staten in de jaren 1990.",
  "characteristicIngredients": "Twee- of zesrij gerst met tot 40% rijst of maïs als hulpgranen. Extra enzymen kunnen het lichaam verder verlichten en koolhydraten verlagen. Lagergist. Verwaarloosbare hop.",
  "styleComparison": "Een lichter, lager alcohol, lagere calorie versie van een American Lager. Minder hopkarakter en bitterheid dan een Duitse Leichtbier.",
  "entryInstructions": "Deelnemer mag regionale variaties specificeren, indien gewenst (Mexicaans lager, Nederlands lager, etc.).",
  "vitalStatistics": {
    "og": {
      "min": 1.028,
      "max": 1.04
    },
    "fg": {
      "min": 0.998,
      "max": 1.008
    },
    "ibu": {
      "min": 8,
      "max": 12
    },
    "srm": {
      "min": 2.0,
      "max": 3.0
    },
    "abv": {
      "min": 2.8,
      "max": 4.2
    }
  },
  "commercialExamples": [
    "Bud Light",
    "Coors Light",
    "Grain Belt Premium Light American Lager",
    "Michelob Light",
    "Miller Lite",
    "Old Milwaukee Light"
  ],
  "tags": [
    "session-strength",
    "pale-color",
    "bottom-fermented",
    "lagered",
    "north-america",
    "traditional-style",
    "pale-lager-family",
    "balanced"
  ]
}